,date,title,contents
0,2022/08/01,"강화군, SNS 통해 밀착 소통 앞장",군은 ‘강화군청 카카오채널’를 활용해 군민에게 생활밀착형 정보를 알기 쉽게 설명하고 현장의 목소리에 귀를 기울이는 정보 제공으로 ‘소통의 방’ 역할을 하고 있다. ‘강화군청 카카오채널’은 블로그...
1,2022/08/01,"은평구, ‘하반기 민방위 보충교육’ 실시","교육대상자에게는 공인전자문서중계자(카카오페이, 네이버, KT)를 통해 모바일 교육통지서를 발송할 예정이다. 자세한 교육 일정은 통지서를 확인하면 된다. 기초생활보장수급자 등 자체교육 인정자와 온라인교육..."
2,2022/08/01,"[마감] 삼성전자, 약보합세 마감...초등학교 입학 연령 하향 추진에 교육주 강...","LG에너지솔루션(-0.59%), SK하이닉스(-0.82%), 카카오(-1.07%), 기아(-0.99%) 등은 소폭 하락했다. 삼성전자(-0.16%)는 약보합세로 마감했다. 국제 신용평가사 스탠더드앤드푸어스(S&amp;P)는 이날 보고서를 통해 ""인플레이션..."
3,2022/08/01,댄스듀오 라이언·춘식 돌아온다… 8월 컴백 예고,라이언&amp;춘식 ‘후즈 넥스트’ 티저 포스터 카카오프렌즈의 인기 댄스듀오 라이언&amp;춘식(이하 라춘듀오)이 8월 12일 컴백한다. 8개월 만이다. 소속사 카카오는 1일 자정 공식 SNS 채널들을 통해 통해 라춘듀오의 ‘후즈...
4,2022/08/01,[현장EN:]질문하고 고찰하는 창작자 지코의 '개운한' 컴백,"오는 4일 엠넷 '엠카운트다운'이 첫 방송이다. ※CBS노컷뉴스는 여러분의 제보로 함께 세상을 바꿉니다. 각종 비리와 부당대우, 사건사고와 미담 등 모든 얘깃거리를 알려주세요.이메일 : 카카오톡 : @노컷뉴스"
5,2022/08/01,"ATBO 데뷔곡 '모노크롬(컬러)' 뮤비, 5일만에 2000만뷰 돌파 '무서운 신예'…...","카카오엔터테인먼트 산하 음악 레이블로 에이핑크, 빅톤, 더보이즈, 위클리 등이 소속된 IST엔터테인먼트가 새롭게 선보이는 ATBO는 오준석, 류준민, 배현준, 석락원, 정승환, 김연규, 원빈까지 탄탄한 실력과 뛰어난..."
6,2022/08/01,[미리보는 이데일리 신문] 공공기관 2차 지방이전...시작부터 졸속 우려,"음류-주류 불티 -‘굴욕’ 스타벅스, 중고거래-정부도 손절 -읽은 시만 1만 3000여편...카카오AI, 시인 데뷔 -과기부 “휴대용 목, 손 선풍기 전자파, 인체에 안전” △15면 -종근당 “케이캡 불확실성, 지텍-누보로젯으로..."
7,2022/08/01,"[해양수산 뉴스] 수산자원공단, ‘부산어촌 서포터즈’ 발대식 外","한편, IPA는 국민들이 쉽게 정책제안을 할 수 있도록 △국민제안 바다(누리집) △인천항 안전해(카카오톡 채널) △인천항 협력해(카카오톡 채널) 등의 소통채널을 운영하고 있다. ◆KIOST, 미국 선급협회(ABS) 선박..."
8,2022/08/01,"대통령실 ""국민제안 상위 3건 선정 않기로…어뷰징 때문""","임대인의 세금 완납 증명서 첨부 의무 신설 등이 포함됐다. ※CBS노컷뉴스는 여러분의 제보로 함께 세상을 바꿉니다. 각종 비리와 부당대우, 사건사고와 미담 등 모든 얘깃거리를 알려주세요.이메일 : 카카오톡 : @노컷뉴스"
9,2022/08/01,"땅땅치킨, 안방극장 사로잡은 '미남당' 제작 지원","서인국과 오연서가 주연으로 출연 중인 KBS 2TV 월화드라마 '미남당'은 전직 프로파일러이자 현직 박수무당이 펼치는 좌충우돌 미스터리 코믹 수사 극이며, 카카오페이지에서 15만 독자를 달성한 정재한 작가의 화제작..."
10,2022/08/01,시 쓰고 그림 그리고… 예술영역 넘보는 AI,카카오의 AI 개발 자회사 카카오브레인은 미디어아트 그룹 슬릿스코프와 함께 시 쓰는 AI 모델 ‘시아’를 개발하고 시아가 쓴 첫 시집 ‘시를 쓰는 이유’를 오는 8일 출간한다고 1일 밝혔다. 시아는 카카오브레인의...
11,2022/08/01,"권영세 ""탈북민 '전원 수용' 원칙, 필요하면 尹에도 건의""","수용해) 우리 사법절차에 따라 심사했어야 했다""고 강조했다. ※CBS노컷뉴스는 여러분의 제보로 함께 세상을 바꿉니다. 각종 비리와 부당대우, 사건사고와 미담 등 모든 얘깃거리를 알려주세요.이메일 : 카카오톡 : @노컷뉴스"
12,2022/08/01,"경북도, 고독사 예방 시법사업 실시","또 사각지대 발굴의 날(매월 둘째주), 경북 마음안심 서비스(스마트폰 사용시간 감지로 고독사 위험을 알리는 스마프폰 앱), 카카오톡 희망톡방(위험신고방) 개설, 사각지대 발굴·운영 지원사업 등도 추진해 왔다.도는..."
13,2022/08/01,예천 새로운 명소 ‘금당마루’ 카페 OPEN,"‘금당마루’는 예천군 농촌활력지원센터에 위탁해 운영 되며 커피 등 20여 종류 음료 외에 시골 정취가 묻어나는 가래떡 구이, 가나에서 직수입하는 카카오로 만든 카카오 강정 등 특색있는 메뉴로 관광객과 주민들의..."
14,2022/08/01,‘환경·사회 문제 개선하세요’…자산운용사가 달라졌다,메리츠자산운용은 지난해 카카오에 탄소 배출량 정보와 기후변화 대응 목표와 전략 등이 담긴 탄소정보 공개(CDP) 요구에 3년 동안 응답하지 않은 사유를 공개하라고 압박했다. 이에 카카오는 “2021년까지 환경 데이터를...
15,2022/08/01,요즘 핫한 브랜드라면 꼭 만드는 ‘브랜드 다큐’ 4,"브랜드의 팬이 아니어도 진지하게 보게 되는 토스, 오늘의집, 무신사, 카카오의 브랜드 다큐 모음. 토스 라는... 카카오 &lt;카카오의 상상법&gt;이라는 제목이 인상적인 카카오의 브랜드 다큐멘터리는 'if?'라는 물음을 통해..."
16,2022/08/01,"""국내선 왕복 항공권 예매시 10% 할인""","농협카드로 10만원 이상 결제 시 1만원, 5만원 이상 결제 시 5천원 할인 적용되는 쿠폰을 제공하며, 티웨이페이로 15만원 이상 결제 시 1만원 할인, 카카오페이로 20만원 이상 결제 시 5천원, 50만원 이상 결제 시 2만원..."
17,2022/08/01,"QR코드로 간편 대여…‘타슈2’ 직접 타보니 “편해졌는데, 타려고 보면 없슈...","거기에 타슈2를 세우고 잠금장치를 잠그고 나자, 카카오톡을 통해 ‘고객님의 반납이 완료됐습니다’라는 메시지가 왔다. 요금은 ‘0원’으로 떴다. 대전시는 지난 1월1일부터 타슈의 초기 1시간 이용요금을 무료화한..."
18,2022/08/01,"코스피, 외인과 개인 매수에 상승 마감…삼성SDI, LG화학 상승 VS 카카오, 기...","46%), LG화학(1.66%), 삼성바이오로직스(1.50%)를 제외하고 하락 마감했다. 카카오(-1.07%), 기아(-0.99%), SK하이닉스(-0.82%), LG에너지솔루션(-0.59%), 삼성전자(-0.16%) 등이 하락 마감했다."
19,2022/08/01,예천 금당실 마을 금당마루 카페 문열어,"커피 등 20여 종류 음료 외에 시골 정취가 묻어나는 가래떡 구이, 가나에서 직수입하는 카카오로 만든 카카오 강정 등 특색있는 메뉴로 관광객과 주민들의 입맛을 사로잡을 계획이다. 특히 이전의 금당주막을 카페로..."
20,2022/08/02,"[마감] 한화에어로스페이스, 신고가 경신...펠로시 대만 방문에 '긴장 고조'","89%), 카카오(-2.97%) 등이 하락했다. 삼성전자(0.65%), 현대차(0.26%), 기아(1.00%) 등이 상승했다.... HLB(3.26%), 카카오게임즈(0.20%), 알테오젠(0.16%), 스튜디오드래곤(2.82%)은 상승했다. 아스플로는 무상증자 권리락에 따른..."
21,2022/08/02,"카카오페이 ""하반기 비개발 인력 채용 축소할 것""","카카오페이가 남은 하반기 비개발 인력 채용 계획을 축소한다. 신원근 카카오페이 대표는 2일 오후 진행된 2분기 실적 컨퍼런스 콜에서 ‘인플레이션, 환율 상승 등 변화된 경제 상황에 대처하기 위해 하반기에..."
22,2022/08/02,"강원도 고성군, 코로나19 4차 접종 확대 추진","단 출국 및 입원·치료 등 개인 사유가 있을 때는 3차 접종 후 3개월(90일) 이후에도 접종할 수 있으며, 확진자는 감염 후 3개월 이후에 가능하다.접종 대상자는 25일부터 카카오톡·네이버를 통해 잔여 백신을..."
23,2022/08/02,"이영진 헌법재판관, 골프 접대 의혹…""재판 도운 적 없다""(종합)","생각한다는 점을 다시 한번 말씀드린다""고 고개를 숙였다. ※CBS노컷뉴스는 여러분의 제보로 함께 세상을 바꿉니다. 각종 비리와 부당대우, 사건사고와 미담 등 모든 얘깃거리를 알려주세요.이메일 : 카카오톡 : @노컷뉴스"
24,2022/08/02,"한국사형폐지범종교연합회, 사형제 위헌 결정 촉구","CBS뉴스 오요셉입니다. [영상기자 정용현] [영상편집 김다솔] ※CBS노컷뉴스는 여러분의 제보로 함께 세상을 바꿉니다. 각종 비리와 부당대우, 사건사고와 미담 등 모든 얘깃거리를 알려주세요.이메일 : 카카오톡 : @노컷뉴스"
25,2022/08/02,"음식물처리기 판매몰 푸드타파, '31일까지 무이자 할부' 이벤트 진행","동작되는 것으로 알려져 있으며 처리 중 과도한 소음이나 악취의 발생을 최소화한 제품이라고 한다. 푸드타파 관계자는 ""금번 이벤트에 대한 보다 자세한 사항은 푸드타파 카카오톡센터로 문의를 부탁드린다""라고 말했다."
26,2022/08/02,"통일교 美 정치권 유착 의혹까지…""부시 전 대통령 연설 1회 13억 지급""","신자들뿐만아니라 정치권도 이용당하고 있다는 이야기다. ※CBS노컷뉴스는 여러분의 제보로 함께 세상을 바꿉니다. 각종 비리와 부당대우, 사건사고와 미담 등 모든 얘깃거리를 알려주세요.이메일 : 카카오톡 : @노컷뉴스"
27,2022/08/02,"이영진 헌재 재판관, 골프 접대 의혹…""재판 도운 적 없다""","2018년 바른미래당의 추천으로 헌법재판관에 임명됐다. ※CBS노컷뉴스는 여러분의 제보로 함께 세상을 바꿉니다. 각종 비리와 부당대우, 사건사고와 미담 등 모든 얘깃거리를 알려주세요.이메일 : 카카오톡 : @노컷뉴스"
28,2022/08/02,"실수 하나에 날아간 승점 3점…울산, 서울과 1대1 무승부","성남FC는 제주 유나이티드를 2대1로 꺾고, 2연승을 달렸다. ※CBS노컷뉴스는 여러분의 제보로 함께 세상을 바꿉니다. 각종 비리와 부당대우, 사건사고와 미담 등 모든 얘깃거리를 알려주세요.이메일 : 카카오톡 : @노컷뉴스"
29,2022/08/02,"카카오, 석달간 계열사 8개 신규 편입",가운데 카카오가 가장 많은 계열사를 편입한 것으로 나타났다. 2일 공정거래위원회가 공개한 ‘5∼7월 대규모기업집단 소속회사 변동 현황’을 보면 카카오는 3개월간 8개 계열사를 신규편입했다. 이는 같은 기간...
30,2022/08/02,‘시중은행보다 금리 낮네’ 인터넷은행 가계대출 7개월째 증가,"카카오뱅크와 케이뱅크 등 인터넷전문은행의 가계대출 잔액이 7개월 연속 증가했다. 2일 은행권에 따르면 카카오뱅크와 케이뱅크의 지난달 말 여신 잔액은 각각 26조9504억원, 9조1600억원으로 집계됐다. 전달 대비..."
31,2022/08/02,"[동향] 배송 경쟁 분화, 각자 잘할 수 있는 곳에 진지 구축중","이외에도 카카오모빌리티, 팀프레시, 메쉬코리아에 투자했다. 딜리버리히어로코리아 인수로 인한 시너지 효과로 퀵커머스 게임체인저로 여겨졌다. GS25나 GS슈퍼마켓 등을 MFC로 활용하는 시너지 효과가 예상됐기..."
32,2022/08/02,배달 실수 지적하자... 뿔난 점주의 답변 “목소리도 안 예쁜게”,해당 식당 상호명을 찾아 카카오맵에 ‘별점 테러’를 하는 네티즌들도 있었다. 이들은 별점 1점과 함께 “사장 무서워서 음식 시키겠나” “손님에게 건방지다고 하다니” 등의 글을 남겼다. 식당에 달린 리뷰 84개 중...
33,2022/08/02,"코스닥, 외인과 기관 매도에 하락 마감…HLB, 스튜디오드래곤 상승 VS 에코프...","HLB(3.26%), 스튜디오드래곤(2.82%), 카카오게임즈(0.20%), 알테오젠(0.16%)이 상승 마감했다. 이에 반해 에코프로비엠(-1.72%), 천보(-1.15%), 셀트리온제약(-0.96%), 엘앤에프(-0.79%), 펄어비스(-0.57%), 셀트리온헬스케어(-0...."
34,2022/08/02,"[공매도 TOP 10 종목] 코스피, 대한전선 공매도 1위…우리금융지주-두산에너빌...","(17만3159주), 카카오뱅크(16만2375주), 금호타이어(15만5311주), 한화생명(15만4609주), 현대두산인프라코어(13만9348주), 팬오션(14만5700주), 대우건설(14만946주), 한화시스템(13만5186주) 순으로 뒤를 이었다. 카카오뱅크..."
35,2022/08/02,"""상장사 대주주, 31일까지 양도세 신고·납부""","국세청은 문자메시지 또는 카카오톡으로 모바일 안내문이 발송돼 간단한 본인 인증을 거쳐 안내 내용을 확인할 수 있고, 모바일 안내가 불가능한 경우(다수 회선자, 수신거부 등)와 60세 이상 납세자에게는 종이 안내문을..."
36,2022/08/02,"리버풀, 조타와 연장 계약 체결…2027년까지 동행","햄스트링 부상으로 프리시즌에 참여하지 못하고 있다. ※CBS노컷뉴스는 여러분의 제보로 함께 세상을 바꿉니다. 각종 비리와 부당대우, 사건사고와 미담 등 모든 얘깃거리를 알려주세요.이메일 : 카카오톡 : @노컷뉴스"
37,2022/08/02,'BIX 2022' 3일 개막…제약·바이오 최신 트렌드 한눈에,아울러 카카오VX 골프 시타 코너도 흥행 요소가 될 전망이다. 주요 후원사로 △삼성바이오에피스 △써모피셔 사이언티픽 △사토리우스 △에스랩 △싸이티바 △엔비로테이너 △UPS 헬스케어 △쉥커 코리아...
38,2022/08/02,북구 ‘정책 키워드 찾기’ 행사,SNS 이용자 누구나 참여 가능한 이번 행사는 카카오톡 채널 및 페이스북 등 북구 SNS와 친구를 맺은 후 주어진 그림 속 민선 8기 북구 정책 키워드를 찾아 카카오톡이나 네이버폼에 정답을 순서대로 제출하면 된다.
39,2022/08/02,클래식 가족음악회 '밤의 요정 빅토리아' 8월 5일 티켓 오픈,"그 외 자세한 사항은 시흥시 음악협회 홈페이지 및 전화, 카카오채널 시흥시 음악협회로 문의하면 된다. 시흥시 중부건강생활지원센터는 세계모유수유주간을 맞아 8월 1일부터 7일까지 모유수유 캠페인을 운영한다. 매년..."
40,2022/08/03,"비대위 반대한 김웅, '국힘 바로 세우기' 설문조사 나서…""공론장 기대""","설문지에는 개인정보 수집 및 이용 동의 여부와 함께 이름, 나이, 성별, 거주지, 전화번호, 이메일 주소, 카카오톡 오픈 채팅방 초대 동의 여부, 국민의힘에게 한 마디를 쓸 수 있는 문항이 나열됐다. 국민의힘은 지난 1일..."
41,2022/08/03,"[마감] LG에너지솔루션, 시총 100조원 재돌파...중국 대만 규제에 식품주 강세","45%), 카카오(5.85%) 등이 상승했다. 삼성전자(-0.65%) 등은 내렸다. LG에너지솔루션(4.80%)은 이날 종가... 카카오게임즈(13.98%)는 연결 기준 올해 2분기 영업이익이 810억원으로, 지난해 동기보다 900.2% 증가한..."
42,2022/08/03,펠로시의 '대만 18시간'…中에 굴복안했지만 대만 긴장은 최고조,"인정하는 데 훨씬, 훨씬 가까이 가고 있다""고 우려를 나타냈다. ※CBS노컷뉴스는 여러분의 제보로 함께 세상을 바꿉니다. 각종 비리와 부당대우, 사건사고와 미담 등 모든 얘깃거리를 알려주세요.이메일 : 카카오톡 : @노컷뉴스"
43,2022/08/03,"윤 대통령·김건희 여사, 휴가 중 대학로 연극 관람…배우들과 만찬도","서울에 남아 휴식을 취하며 정국 구상에 집중하고 있다. ※CBS노컷뉴스는 여러분의 제보로 함께 세상을 바꿉니다. 각종 비리와 부당대우, 사건사고와 미담 등 모든 얘깃거리를 알려주세요.이메일 : 카카오톡 : @노컷뉴스"
44,2022/08/03,與 비대위 속도전에 친이준석계 '집단 반격'…소송전·여론전 '총동원',"출정이다""라는 글과 함께 이름·연락처·거주지역·카카오톡 오픈채팅방 초대 동의 여부를 묻는 구글폼... 웹페이지 설문 항목에는 '관련 카카오톡 오픈 채팅방 초대 동의 여부'를 묻는 질문이 있는데, 비대위 전환에..."
45,2022/08/03,"尹 ""파출소 경찰관마다 권총 지급 검토…사격훈련 강화""","훈련할 수 있도록 하반기부터 시행할 계획인 것으로 전해졌다. ※CBS노컷뉴스는 여러분의 제보로 함께 세상을 바꿉니다. 각종 비리와 부당대우, 사건사고와 미담 등 모든 얘깃거리를 알려주세요.이메일 : 카카오톡 : @노컷뉴스"
46,2022/08/03,"김웅 ""비대위 전환은 당 와해"" 당원 생각 묻는 설문조사 띄웠다",해당 설문양식에는 이름·나이 등 개인정보와 함께 '관련 카카오톡 오픈 채팅방 초대 동의 여부' 등을 표시하게 돼 있다. SNS를 통해 당의 비대위 체제 전환이 반대하는 세력을 결집하겠다는 뜻으로 읽힌다. 김 의원은 지난...
47,2022/08/03,기로에 선 창원 공영자전거 '누비자',지난 6월 15일부터 카카오T바이크 1000여 대가 창원시에 깔렸다. 이 탓에 민영 카카오T바이크가 확산·성장하면서 공영자전거 누비자가 타격을 받지 않을까 우려하는 목소리가 나오고 있다. 기초지자체 단위에서 민영...
48,2022/08/03,"""대출 금리 내려달라"" 수용률 26.6% 불과",인터넷은행 중에서는 케이뱅크의 지난해 금리인하요구권 수용률이 12.3%에 불과했고 카카오뱅크는 25.7%였다. 금리인하요구권 제도가 활성화되지 않자 금융당국은 이달부터 금융사의 금리인하요구권 운영 실적을...
49,2022/08/03,"코로나19 재유행, 의료대응여건 조성…동네 병·의원 중심 일반의료체계로 전...","포털사이트(네이버, 카카오)와 생활안전지도 등에서 신속검사와 처방을 위한 호흡기환자진료센터(원스톱 진료기관) 검색이 가능하며, 보건소 및 선별진료소 등에서 의료기관 명단을 담은 안내문을 배포하고 있다. 또..."
50,2022/08/03,"코로나19 재유행, 의료대응여건 조성…동네 병·의원 중심 일반의료체계로 전...","포털사이트(네이버, 카카오)와 생활안전지도 등에서 신속검사와 처방을 위한 호흡기환자진료센터(원스톱 진료기관) 검색이 가능하며, 보건소 및 선별진료소 등에서 의료기관 명단을 담은 안내문을 배포하고 있다. 또..."
51,2022/08/03,"'김혜경 법인카드 의혹' 핵심, 배모씨 경찰 조사","이 카드는 '바꿔치기 결제'에 사용됐던 것으로 알려졌다. ※CBS노컷뉴스는 여러분의 제보로 함께 세상을 바꿉니다. 각종 비리와 부당대우, 사건사고와 미담 등 모든 얘깃거리를 알려주세요.이메일 : 카카오톡 : @노컷뉴스"
52,2022/08/03,"예상보다 견고한 시장 흐름..미국 상승 속 비트코인,이더리움 시장 견인..대만...",카카오(035720) 카카오페이(377300)가 5% 이상 강세로 거래를 마감했다. 이어 LG에너지솔루션(373220)도 4% 이상 올랐고 네이버(035420) 카카오뱅크(323410)도 3% 이상 상승하며 거래를 마쳤다. 특히 2분기 역대 최대 실적을 낸...
53,2022/08/03,우리은행 “가계대출 우대금리 쉽게 확인하세요”,충족되지 않았다면 이를 채울 수 있는 상품이나 서비스에 가입할 수도 있다. 우리은행은 향후 매달 우대금리 현황을 카카오톡 알림으로 발송해 우리WON뱅킹에 접속하지 않고도 금리 변동내역을 확인할 수 있게 할 예정이다.
54,2022/08/03,"계양구, 제77주년 광복절 태극기 달기 운동 추진","구는 동 행정복지센터를 비롯해 관내 각급 학교에 태극기 달기 운동을 적극 홍보하고, 각 가정에서 자발적으로 태극기를 게양할 수 있도록 구 홈페이지와 블로그, 카카오톡 등을 통한 다양한 홍보를 실시할 계획이다...."
55,2022/08/03,계양구 민선 8기 구정 발전 위한 혁신정책 제안 공모전,"이번 공모전은 계양구 구민이면 누구나 참여할 수 있으며 카카오톡 채널 '계양혁신톡', 국민신문고, 이메일, 우편 등을 통해 접수할 수 있다. 접수된 제안은 실시 가능성, 창의성, 효과성, 계속성, 적용 범위 등 심사..."
56,2022/08/03,"[증권 리포트] SK證 ""카카오페이 점진적 수익 개선""...KB證 ""삼성전자, OLED가...","◆카카오페이, 3분기부터 점진적 수익성 개선 SK증권은 카카오페이가 올해 3분기부터 점진적인 수익성 개선이 이뤄질 것으로 예상. 최관순 SK증권 연구원은 3일 보고서에서 ""카카오페이는 2분기 실적 저점으로 3분기..."
57,2022/08/03,웹툰 ‘네가 보고 내가 느끼는’ 드라마화 결정,"‘네가 보고 내가 느끼는&gt;’ 현재 카카오페이지, 네이버시리즈, 리디북스, 레진코믹스 등 다수의 플랫폼에 서비스되고 있다. 2015년 완결 이후 꽤 시간이 흐른 이 작품이 지금에 이르러 드라마 계약이 이뤄진 점에 대해..."
58,2022/08/03,"키움 안우진, 마음가짐도 에이스 ""득점 지원 적어도 서운하지 않다""","역할에 최선을 다하겠다는 것, 바로 에이스의 마음가짐이다. ※CBS노컷뉴스는 여러분의 제보로 함께 세상을 바꿉니다. 각종 비리와 부당대우, 사건사고와 미담 등 모든 얘깃거리를 알려주세요.이메일 : 카카오톡 : @노컷뉴스"
59,2022/08/03,"포스코건설, ESG경영 관심도 '최상위권'…국내 도급 30대 건설사 분석",3일 데이터앤리서치는 뉴스·커뮤니티·카페·유튜브·트위터·인스타그램·페이스북·카카오스토리·지식인·기업/조직·정부/공공 등 12개 채널을 대상으로 30대 건설사에 대한 ESG경영 온라인 정보량(포스팅 수...
60,2022/08/04,"코스피, 외인 매수에 0.47% 상승 마감...2,470선 회복","카카오 7.5%·카카오뱅크 4.78%·카카오페이 14.95% 올라 코스피가 외국인 순매수 유입 지속에 따라 2,470선에 마감했다. 한국거래소에 따르면 4일 코스피는 전 거래일보다 11.66포인트(0.47%) 오른 2,473.11에 장을..."
61,2022/08/04,"[마감] 카카오, 2분기 최대실적에 '강세'...위메이드, '위믹스3.0' 출시 기대...","카카오(7.50%)는 연결 기준 올해 2분기 영업이익이 1710억원으로 5.2% 증가한 것으로 잠정 집계됐다고... 카카오뱅크(4.78%), 카카오페이(14.95%) 등 다른 카카오그룹주도 강세였다. 코스닥지수는 전 거래일보다 9...."
62,2022/08/04,"카카오뱅크 플랫폼 강화로 상반기 사상 최대실적, 윤호영 연임 청신호",윤호영 카카오뱅크 대표이사가 플랫폼 강화를 통해 상반기 최대 실적을 거뒀다. 윤 대표는 2023년 3월까지가 임기인데 하반기에도 호실적을 이어간다면 재연임에 힘이 실릴 것으로 보인다. 윤호영 카카오뱅크...
63,2022/08/04,[공연] 파포스 [대학로예술극장 소극장],"++ 인공지능 시아 시아는 2021년 카카오브레인의 초거대 AI 언어 모델 KoGPT를 기반으로 태어난 시를 쓰는 인공지능이다. 인터넷 백과사전, 뉴스 등을 읽으며 한국어를 공부하고, 약 1만 편의 시를 읽고서 작법을 배워 시를..."
64,2022/08/04,서울대 창업경진대회 ‘더비기닝 시즌 4’ 참가자 모집,"서울대 기술지주(주), 소풍벤처스, KT, 스마일게이트홀딩스, 카카오벤처스, 액트너랩, 어썸레이 등의 기업이 전담멘토단으로 참여하여 창업기업의 성장에 힘을 실어줄 수 있을 것으로 기대된다. 공모 분야의 제한은 없으..."
65,2022/08/04,[단독]'수사기밀 유출' 연루 檢 출신 쌍방울 임원 '긴급체포'(종합),"빠져나갈 대응책 마련에 분주하다는 얘기가 파다하다. ※CBS노컷뉴스는 여러분의 제보로 함께 세상을 바꿉니다. 각종 비리와 부당대우, 사건사고와 미담 등 모든 얘깃거리를 알려주세요.이메일 : 카카오톡 : @노컷뉴스"
66,2022/08/04,"중국→대만 미사일 5발, 엉뚱한 일본 수역에 낙하","대만의 동서남북 사방에 장거리포와 미사일을 쏟아 부었다. ※CBS노컷뉴스는 여러분의 제보로 함께 세상을 바꿉니다. 각종 비리와 부당대우, 사건사고와 미담 등 모든 얘깃거리를 알려주세요.이메일 : 카카오톡 : @노컷뉴스"
67,2022/08/04,'1위는 다르다' SSG 투타 저력 빛난 역전승…키움은 LG에 밀려 3위로,"피한 뒤 박찬혁을 범타로 처리해 연장 승부를 끝냈다. ※CBS노컷뉴스는 여러분의 제보로 함께 세상을 바꿉니다. 각종 비리와 부당대우, 사건사고와 미담 등 모든 얘깃거리를 알려주세요.이메일 : 카카오톡 : @노컷뉴스"
