,date,title,contents
416,2022/08/21,한진선 '생애 첫 우승컵 번쩍'[포토],"한진선(25.카카오VX)이 금일 4개를 줄이며 11언더파 277타(70-72-67-68)로 2016년 데뷔 후 생애 첫 역전 우승을 차지했다. 공동 2위로는 9언더파 279타로 유해란, 최예림이 차지했다."
417,2022/08/21,"이주노동자, ""尹정부 인력공급 정책만 있을 뿐 권리보장책 없어""","※CBS노컷뉴스는 여러분의 제보로 함께 세상을 바꿉니다. 각종 비리와 부당대우, 사건사고와 미담 등 모든 얘깃거리를 알려주세요.이메일 : 카카오톡 : @노컷뉴스사이트 : https://url.kr/b71afn"
418,2022/08/21,수원 주택서 모녀 추정 여성 3명 숨진 채 발견…극단선택 가능성,"※CBS노컷뉴스는 여러분의 제보로 함께 세상을 바꿉니다. 각종 비리와 부당대우, 사건사고와 미담 등 모든 얘깃거리를 알려주세요.이메일 : 카카오톡 : @노컷뉴스사이트 : https://url.kr/b71afn"
419,2022/08/21,‘무궁무진 캐릭터산업’ 부산 캐릭터는 언제쯤?,"[김동완·정다은/대구 동구 : ""원래도 카카오 프렌즈 캐릭터를 좋아하는데 여기 와서 보니까 스마트폰이랑... ""] 해운대 한 호텔 별관에 3천 제곱미터 규모 공간에 들어선 이 멀티미디어 테마파크는 '카카오 캐릭터..."
420,2022/08/22,"광주은행, 가계예대금리차 전국 3위…전국 19개 은행 중","이어 케이뱅크와 카카오뱅크가 뒤를 이으면서 지방은행과 인터넷은행이 가계예금금리차 1~5위를... 각종 비리와 부당대우, 사건사고와 미담 등 모든 얘깃거리를 알려주세요.이메일 : 카카오톡 : @노컷뉴스사이트..."
421,2022/08/22,"넥슨게임즈 주식, 신작 출시 사흘 앞두고 13.6% 하락",한편 카카오게임즈의 '우마무스메: 프리티 더비' 또한 운영 관련 논란이 불거졌고 카카오게임즈의 이날 주가는 시가 대비 3.43% 하락한 5만3500원으로 집계됐다. '우마무스메'의 구글 플레이스토어 평점은 20일 기준...
422,2022/08/22,"예천군, 안심식당 100곳 연말까지 추가 지정","안심식당으로 지정되면 군청 홈페이지 홍보는 물론 네이버, 다음 포털사이트, T-map, 카카오맵 앱에서 안심식당을 검색하면 주변의 지정된 업소로 안내돼 지역을 찾는 관광객이나 군민들이 안심하고 음식점을 이용할..."
423,2022/08/22,"與윤리위, '수해 망언' 김성원 징계절차 개시···이준석은 논의 '보류'","※CBS노컷뉴스는 여러분의 제보로 함께 세상을 바꿉니다. 각종 비리와 부당대우, 사건사고와 미담 등 모든 얘깃거리를 알려주세요.이메일 : 카카오톡 : @노컷뉴스사이트 : https://url.kr/b71afn"
424,2022/08/22,"[마감] 쏘카-대성하이텍, 상장 첫날 엇갈린 주가...코스닥, 2.25% 하락","01%), 카카오(-2.22%) 등이 하락했다. 반면 기아(0.26%)는 상승했다. 이날 코스피에 입성한 쏘카는... 시가총액 상위 종목은셀트리온헬스케어(-0.4%), 에코프로비엠(-0.88%), 엘앤에프(-3.25%), HLB(-1.4%), 카카오게임..."
425,2022/08/22,신한은행이 이자 수익 가장 높아,"케이뱅크가 2.46%포인트, 카카오뱅크가 2.33%포인트였다. 후발주자는 토스뱅크가 5.60%포인트로 가장 높았다. 이에 대해 토스뱅크는 ""중·저신용자 대출 비중이 38%로 은행 중 가장 크고, 2% 금리의 수시입출금 통장이..."
426,2022/08/22,"[ESG경영] 김태현 예보 사장 ""국가와 국민의 금융안정 위해 노력하겠다""","간편인증 서비스는 삼성패스, 통신사패스, KB모바일, 페이코, 카카오 등 5가지 간편인증서 중 선택해 미수령금 조회·신청이 가능하다. 행정안전부와 협업해 사망자 및 법인 전수조사를 통해 개별안내도 강화했다. 이에..."
427,2022/08/22,하루 4천명대 확진… 소아청소년·50세 이상 4차접종 '꼭',"코로나19 예방접종 방법은 네이버·카카오톡으로 잔여백신 예약이나 의료기관 유선연락 후 당일 접종 가능하며, 사전예약 누리집(ncvr.kdca.go.kr)이나 전화예약(☎1339, 보건소)을 통해 사전예약 후 접종이 가능하다."
428,2022/08/22,"‘1스마트폰 2번호’ e심, 이동통신 시장 흔드나",‘국민 메신저’로 자리잡은 카카오톡의 경우 삼성 스마트폰은 듀얼메신저 기능을 지원하기 때문에 하나의 스마트폰에서 동일한 메신저 앱을 2개 내려받아 동시에 사용할 수 있다. 하지만 듀얼메신저 기능을 지원하지...
429,2022/08/22,"이창양 장관 ""美 인플레이션 감축법, WTO에 제소 검토""","※CBS노컷뉴스는 여러분의 제보로 함께 세상을 바꿉니다. 각종 비리와 부당대우, 사건사고와 미담 등 모든 얘깃거리를 알려주세요.이메일 : 카카오톡 : @노컷뉴스사이트 : https://url.kr/b71afn"
430,2022/08/22,"카카오, 모빌리티 매각은 중단했지만 장애물 '잔뜩'",유료 서비스 관련한 근로자 단체활동 지속 카카오모빌리티 문제 해결 추이 중소상권 침해 논란 달려 김종형 기자 jhkim911@ajunews.com [사진=카카오 ] [이코노믹데일리] 카카오가 카카오모빌리티의 매각은 철회했지만 근로자...
431,2022/08/22,김광열 영덕군수 선거운동원 4명 구속…공직선거법 위반 혐의,"※CBS노컷뉴스는 여러분의 제보로 함께 세상을 바꿉니다. 각종 비리와 부당대우, 사건사고와 미담 등 모든 얘깃거리를 알려주세요.이메일 : 카카오톡 : @노컷뉴스사이트 : https://url.kr/b71afn"
432,2022/08/22,"울산시, 코로나19 예방접종 참여 적극 당부","한편 코로나19 예방접종 방법은 네이버·카카오톡으로 잔여백신 예약이나 의료기관 유선연락 후 당일 접종 가능하며 사전예약 누리집(ncvr.kdca.go.kr)이나 전화예약(1339, 보건소)을 통해 사전예약 후 접종이 가능하다."
433,2022/08/22,"검찰, '사랑의 회초리' 든 아버지 무혐의 처분","검찰에 따르면 최근 A씨는 중학생 딸이 늦은 시간까지 휴대전화를 하고, 카카오톡으로 상급생 남자에게 얼굴 사진을 전송하는 것을 보고 회초리로 허벅지 부위를 2~3차례 때렸다. 경찰은 A씨를 아동복지법위반(아동학대)..."
434,2022/08/22,"티맵, KB서 2000억 투자 유치…분사 후 기업가치 2배로 ‘껑충’",최근 보유하고 있던 카카오뱅크 지분 3%를 블록딜로 매각했던 KB국민은행은 티맵모빌리티 지분 8.3％를 보유하면서 4대 주주로 올라섰다. 티맵모빌리티는 KB계열사들의 다양한 서비스를 바탕으로 플랫폼 종사자에...
435,2022/08/22,"상주시 동성동, 공익직불제 의무교육 이수 적극 지원","net)을 통한 온라인 과정과 카카오톡, 문자링크를 통한 모바일 간편 교육, 70세 이상 고령 농업인을 위한 자동응답 전화 교육을 통해서 받을 수 있다.동성동에서는 비대면 교육 이수에 어려움을 겪는 농업인의 편의를..."
436,2022/08/22,"늦은 시간까지 카톡 한 딸에 회초리 든 父, 경찰은 ‘아동 학대’ 혐의 적용…...","뉴시스 중학생 딸이 늦은 시간까지 휴대전화를 하고, 카카오톡으로 남학생에게 자신의 얼굴 사진을 전송하는 것을 보고 화가난 부모가 딸의 허벅지 부위를 2~3처? 때렸다가 ‘아동학대’ 혐의로 검찰에 송치됐지만..."
437,2022/08/22,베일 벗은 예대마진,"케이뱅크가 2.46%포인트, 카카오뱅크가 2.33%포인트 수준이었고 토스뱅크는 5.60%포인트를 기록했다. 이와 관련 토스뱅크 관계자는 ""중·저신용자 대출 비중이 38%로 은행 중 가장 크고 2% 금리의 수시입출금 통장이 주력..."
438,2022/08/22,환율 급등에 韓 증시 또 '털썩',"금리 인상 경계감에 대표적 성장주인 네이버(-1.01%)와 카카오(-2.22%)도 1∼2%대 하락했다. 이날... 엘앤에프(-3.25%), 카카오게임즈(-3.43%), 셀트리온제약(-2.20%), 알테오젠(-2.79%), 에코프로(-2.16%), 천보(-3.20%) 등이..."
439,2022/08/22,"예대금리차 가장 큰 은행은 신한·토스…""서민대출 많아서"" 반론","토스뱅크의 가계예대금리차는 5.6%로, 케이뱅크(2.46%)와 카카오뱅크(2.33%)의 두 배를 훌쩍 넘습니다. 소비자들은 반기는 반응이지만, 백민규 / 부산 동래구 ""은행별로 일목요연하게 정리가 돼있어서 만약에 은행업무가 있을..."
440,2022/08/23,[브리핑] 풀무원·BBQ·교촌·bhc,"이미지=교촌치킨 ◇ 교촌치킨, '카카오톡 플러스친구' 추가시 사이드메뉴 할인쿠폰 교촌치킨은 사이드메뉴 할인 쿠폰을 증정하는 '카카오톡 플러스친구' 친구 추가 이벤트를 진행한다고 23일 밝혔다. 9월 30일까지..."
441,2022/08/23,"""그냥 가려했는데 한 자 적는다""...'수원 세 모녀'가 남긴 숙제","상담전화 ☎1393, 정신건강 상담전화 ☎1577-0199, 희망의 전화 ☎129, 생명의 전화 ☎1588-9191, 청소년 전화 ☎1388, 청소년 모바일 상담 ‘다 들어줄 개’ 어플, 카카오톡 등에서 24시간 전문가의 상담을 받을 수 있습니다."
442,2022/08/23,"SKT, 중기부와 스타트업 성장 지원",2021년 8월에는 카카오와 100억원씩 출자해 총 200억원 규모의 ESG펀드를 조성했고 올해 3월에는 총 400억원 규모의 통신 3사 ESG펀드를 조성해 ESG 분야 스타트업을 지원하고 있다. 여지영 SK텔레콤 ESG얼라이언스 담당은...
443,2022/08/23,"컬러버스, 8월 30일 3D 메타버스 '퍼피레드' 정식 출시","컬러버스 측은 오는 29일 자정까지 사전예약 이벤트를 진행하며, 사전예약 신청자를 대상으로 추첨을 실시해 '아이패드 에어'를 비롯해 유명 카카오 이모티콘 작가 '냥구'와 컬래버레이션한 스페셜 '카카오톡 이모티콘..."
444,2022/08/23,택시비에 치킨값까지 ‘플랫폼의 역습’ [뉴스+],"이제 카카오택시가 없으면 택시를 탈 수 없고, 치킨을 팔기 위해서는 배달 앱의 수수료를 버터야 한다. 과연... 택시와 승객을 효율적으로 연결하겠다던 카카오택시 등 택시 호출 플랫폼의 경우에도 각종 수수료를..."
445,2022/08/23,땅땅치킨 제작지원 KBS2TV드라마 '미남당' 성황리에 종영,"수사극이며, 카카오페이지에서 15만 독자를 달성한 정재한 작가의 화제작 '미남당-사건 수첩'을 원작으로... 장보리', MBC '오자룡이 간다', tvN '화유기', 카카오TV '이 구역의 미친 X' 등에서 다양한 연기를 보여준 배우..."
446,2022/08/23,"수협쇼핑, 추석 명절 수산물 물가 안정에 할인 혜택 풍성",아울러 자신의 카카오톡 프로필을 대한민국 수산대전 이벤트 사진으로 변경해 1주일간 유지하면 적립금 1만 원을 지급하는 ‘대한민국 수산대전 프로 소문러’이벤트도 함께 진행한다. 수협쇼핑 관계자는 “추석...
447,2022/08/23,'빅테크의 급습'...네이버·카톡서 예금·보험 상품 비교추천 서비스,"이에 따르면, 앞으로 예금·보험 상품을 네이버 같은 인터넷 포털이나 카카오톡 등 인터넷 메신저에서 비교... 하지만 금융소비자들은 지난해 하반기 제2금융권은 토스, 카카오페이 등 플랫폼업체들이 대출 비교·추천..."
448,2022/08/23,TV토론 앞서 악수하는 민주당 이재명-박용진 당 대표 후보,"※CBS노컷뉴스는 여러분의 제보로 함께 세상을 바꿉니다. 각종 비리와 부당대우, 사건사고와 미담 등 모든 얘깃거리를 알려주세요.이메일 : 카카오톡 : @노컷뉴스사이트 : https://url.kr/b71afn"
449,2022/08/23,TV토론 나선 민주당 이재명-박용진 당 대표 후보,"※CBS노컷뉴스는 여러분의 제보로 함께 세상을 바꿉니다. 각종 비리와 부당대우, 사건사고와 미담 등 모든 얘깃거리를 알려주세요.이메일 : 카카오톡 : @노컷뉴스사이트 : https://url.kr/b71afn"
450,2022/08/23,토론 준비하는 이재명 후보,"※CBS노컷뉴스는 여러분의 제보로 함께 세상을 바꿉니다. 각종 비리와 부당대우, 사건사고와 미담 등 모든 얘깃거리를 알려주세요.이메일 : 카카오톡 : @노컷뉴스사이트 : https://url.kr/b71afn"
451,2022/08/23,이재명-박용진 더불어민주당 당대표 후보 TV토론회,"※CBS노컷뉴스는 여러분의 제보로 함께 세상을 바꿉니다. 각종 비리와 부당대우, 사건사고와 미담 등 모든 얘깃거리를 알려주세요.이메일 : 카카오톡 : @노컷뉴스사이트 : https://url.kr/b71afn"
452,2022/08/23,토론 준비하는 박용진 후보,"※CBS노컷뉴스는 여러분의 제보로 함께 세상을 바꿉니다. 각종 비리와 부당대우, 사건사고와 미담 등 모든 얘깃거리를 알려주세요.이메일 : 카카오톡 : @노컷뉴스사이트 : https://url.kr/b71afn"
453,2022/08/23,앱만 켜면 은행·보험·카드·증권사 서비스 한번에 ‘OK’,네이버나 카카오 등 핀테크·빅테크 기업들은 온라인 플랫폼을 통해 예적금 상품과 보험 상품 등을 중개할 수 있게 된다. 다만 소비자 보호를 위해 중개 가능한 상품군은 제한된다. 금융위원회는 23일 2차...
454,2022/08/23,"""여름 끝, 추석 시작""... 화장품 업계, 프로모션 다양","또한 일부 온라인 몰(마비스 네이버 스마트 스토어, Hmall, 대백몰, 카카오톡 선물하기)에서는 구매 고객 대상으로 사은품을 추가로 증정한다. 사은품은 금액별로 상이하며 4만원 이상 구매 시 클래식 민트 10ml 3개, 9만원..."
455,2022/08/23,"""보험·카드·증권 모두 은행 앱 하나로""...금융당국 '디지털유니버설뱅크' 지...","또한 카카오페이 등 온라인플랫폼은 예금, 보험 등 금융상품 중개업을 시범적으로 운영할 수 있게 돼 보험 대리점 업계의 큰 반발이 예상된다. ◆ 플랫폼 금융서비스 활성화 등 '디지털 유니버설뱅크' 구축 박병원..."
456,2022/08/23,"검찰, 쌍방울 '수사기밀 유출' 수사관·임원 기소","※CBS노컷뉴스는 여러분의 제보로 함께 세상을 바꿉니다. 각종 비리와 부당대우, 사건사고와 미담 등 모든 얘깃거리를 알려주세요.이메일 : 카카오톡 : @노컷뉴스사이트 : https://url.kr/b71afn"
457,2022/08/23,"'법카 의혹' 김혜경, 5시간만에 경찰 조사 마치고 귀가","※CBS노컷뉴스는 여러분의 제보로 함께 세상을 바꿉니다. 각종 비리와 부당대우, 사건사고와 미담 등 모든 얘깃거리를 알려주세요.이메일 : 카카오톡 : @노컷뉴스사이트 : https://url.kr/b71afn"
458,2022/08/23,"이재명 ""아내는 법카 안 썼다…남편으로서 미안할 뿐""","※CBS노컷뉴스는 여러분의 제보로 함께 세상을 바꿉니다. 각종 비리와 부당대우, 사건사고와 미담 등 모든 얘깃거리를 알려주세요.이메일 : 카카오톡 : @노컷뉴스사이트 : https://url.kr/b71afn"
459,2022/08/23,"구글 TOP 10에 '던파' 밖에 없던 넥슨, '히트2'로 시장 장악 나선다","또 카카오게임즈에서 출시한 '우마무스메', 넷마블게임즈에서 출시한 '세븐나이츠 레볼루션', 컴투스에서 출시한 '서머너즈 워: 크로니클'도 TOP10 안에서 '히트2'와의 대결을 앞두고 기세 등등함을 과시하고 있는..."
460,2022/08/24,“유저 의견 경청해 서비스 개선하겠다” 우마무스메 사과문 발표,"▲우마무스메 공식 카페에 올라온 사과문 (자료출처: 우마무스메 다음 공식 카페) 카카오게임즈가 최근 ‘마차 시위’까지 예고된 우마무스메 국내 서비스에 대한 개선책을 발표했다. 24일 저녁 10시 20분경, 카카오게임즈..."
461,2022/08/24,"검찰, '2천만원 법카 유용'…배씨 구속영장 청구","※CBS노컷뉴스는 여러분의 제보로 함께 세상을 바꿉니다. 각종 비리와 부당대우, 사건사고와 미담 등 모든 얘깃거리를 알려주세요.이메일 : 카카오톡 : @노컷뉴스사이트 : https://url.kr/b71afn"
462,2022/08/24,"[8월 24일 병원계 이모저모①]고려대안암병원, 이화의료원, 한국원자력의학원...","◆고려대안암병원-카카오브레인, 업무협약 체결 고려대학교 안암병원(원장 윤을식)이 카카오브레인(대표 김일두)과 의료 분야에서의 초거대 AI 모델 연구를 위한 업무협약(MOU)을 체결했다. 초거대 AI 기술이 도입된..."
463,2022/08/24,"[8월 24일 병원계 이모저모②]고려대의료원, 분당서울대, 순천향대부천, 아주...","위해 카카오 알림톡을 기반으로 한 모바일 입원수속 및 결제 시스템을 오픈했다. 입원 병실 배정을 받을 때... 먼저 양방향 소통이 가능한 카카오 알림톡 기반의 모바일 입원병실 배정 안내 시스템의 오픈으로, 입원시..."
464,2022/08/24,"[마감] 현대로템, K2흑표전차 수출 기대 '급등'...농심, 가격 인상에 '강세'","시가총액 상위권에서 LG에너지솔루션(1.35%), 삼성SDI(0.68%), 네이버(0.21%), 카카오(0.13%) 등이 올랐고... 반면 카카오게임즈(-1.13%)는 하락했다. 이날 서울 외환시장에서 원·달러 환율은 전날 종가보다 3.4원 내린..."
465,2022/08/24,"[우마무스메:프리티 더비] 1.1 평점의 영향? 우마무스메, 챔피언스 미팅 연기...","구글 평점 '1.1'까지 떨어지며, 마차 시위 예고 등 각종 커뮤니티를 뜨겁게 달구고 있는 우마무스메 프리티 더비(사이게임즈 개발/카카오게임즈 서비스)에서 8월 24일(수) 22:18분 공식 카페 및 게임 내 공지를 통해 최근..."
466,2022/08/24,정부기관 사칭 전화금융사기 급증 '주의',"실제 사례를 보면, 피해자의 카카오톡으로 검사 공무원증이나 구속영장, 공문을 보내 조사 협조를 종용하거나, 피해자가 조사에 협조하겠다고 하면 보안프로그램이라며 링크를 눌러 설치하도록 했다. 피해자가 해당..."
467,2022/08/24,하동 농ㆍ특산물 세트로 감사 전해요,추석 선물세트를 온ㆍ오프라인으로 구매하는 고객에게 5만 원 이상 5000원과 5만 원 이하 2000원의 금오산 케이블카 이용 할인권을 제공한다. 선물세트는 푸드마켓 현장주문과 카카오스토리 하동장터에서 택배 주문할 수 있다.
468,2022/08/24,명예훼손죄에 관한 최근 판례 동향,②(대법원2022도4171판결) 최씨는 지난 2019년 1월 초순 경 고교동창 10여 명이 참여한 단체 카카오톡 채팅방에서 `정씨가 내 돈을 갚지 못해 사기죄로 감방에서 몇 개월 살다가 나왔다. 집에서도 포기한 애다. 너희들도...
469,2022/08/24,"'에버소울'부터 '디스테라'까지, 카카오게임즈 신작 다수 하반기 서비스 예고",카카오게임즈가 22일 글로벌 신작 ‘에버소울’의 신규 일러스트를 공개하며 하반기 서비스 준비에 나섰다.... 10년 이상 개발 노하우 보유한 나인아크의 신작 RPG ‘에버소울’ 카카오게임즈의 기대 신작 RPG...
470,2022/08/24,광주서 또…보육원 출신 청년 극단 선택,"상담 전화 ☎1577-0199, 희망의 전화 ☎129, 생명의 전화 ☎1588-9191, 청소년 전화 ☎1388, 청소년 모바일 상담 '다 들어줄 개' 어플, 카카오톡 등에서 24시간 전문가의 상담을 받을 수 있습니다. 이보배 한경닷컴 객원기자"
471,2022/08/24,'미카엘NFT' 내달 1일 발행,"네이버, 카카오웹툰, SK텔레콤, KT 등 정보기술(IT)및 통신 대기업들이 속속 NFT 발행과 플랫폼 확장에... 올해 초 카카오 엔터테인먼트의 인기웹툰 '나 혼자만 레벨업' IP를 클립드롭스에서 NFT로 100개 한정 발행하면서..."
472,2022/08/24,광주서 보육원 출신 여학생 또 극단선택…남긴 유서 발견,"상담전화 ☎1393, 정신건강 상담전화 ☎1577-0199, 희망의 전화 ☎129, 생명의 전화 ☎1588-9191, 청소년 전화 ☎1388, 청소년 모바일 상담 ‘다 들어줄 개’ 어플, 카카오톡 등에서 24시간 전문가의 상담을 받을 수 있습니다."
473,2022/08/24,우마무스메 진심으로 사과드린다. 재화 추가 지급과 챔피언스 미팅 일정 연기,‘우마무스메 프리티더비’ 이용자들의 불만 폭주로 인한 평점 테러로 곤혹을 치르고 있는 카카오게임즈가 24일 공식 카페를 통해 사과문과 함께 대응 방안을 공개했다. 카카오게임즈는 “먼저 우마무스메 프리티...
474,2022/08/24,수원 세모녀 사건 더 이상 없다...동대문구·성동구 1인 가구 발굴,"한편, 주변에 도움이 필요한 어려운 이웃 발견 시 거주지 동 주민센터 복지플래너, 복지정책과 복지지원팀 또는 ‘온라인 복지도움요청’ , 동대문구 카카오톡 채널 ‘복지누리톡’으로 언제든 도움을 요청할 수 있다...."
475,2022/08/24,"보험영업인 단체, ""빅테크 보험 플랫폼 진출은 생존권 위협""","보험설계사나 대리점과 동일한 형태로 네이버, 카카오,토스 등에 보험대리점업을 허용하려는 것이라는... '국민 메신저' 지위를 누리는 카카오톡과 국내 최대 포털인 네이버는 각각 4000만명이 넘는 회원을 갖고 있다...."
476,2022/08/24,"신한카드, MZ세대에게 사랑받는 이유는 '혁신'","신한카드는 최근 여론조사기관인 데이터앤리서치가 4월부터 6월까지 3개월간 카페·유튜브·블로그·트위터·인스타그램·페이스북·카카오스토리 등, 7개 채널을 대상으로 국내 9개 카드사의 MZ세대 포스팅 수를..."
477,2022/08/24,[8월25일자] 비즈니스포스트 아침의 주요기사,"KB국민은행 티맵모빌리티와 과감한 동맹, 새 먹거리 확보와 플랫폼 강화 ● 3분기 낸드 가격 최대 18% 하락 전망, '반도체 겨울' 강추위 닥치나 ● 네이버 카카오 보험 중개시장 진출 빗장 풀려, 보험업계 기대반 우려반"
478,2022/08/24,공직선거법 위반 혐의 이병노 전남 담양군수…사전구속영장 '기각',"※CBS노컷뉴스는 여러분의 제보로 함께 세상을 바꿉니다. 각종 비리와 부당대우, 사건사고와 미담 등 모든 얘깃거리를 알려주세요.이메일 : 카카오톡 : @노컷뉴스사이트 : https://url.kr/b71afn"
479,2022/08/24,광주서 보육원 출신 20대 여성 극단적 선택…엿새 만에 또 비극,"※CBS노컷뉴스는 여러분의 제보로 함께 세상을 바꿉니다. 각종 비리와 부당대우, 사건사고와 미담 등 모든 얘깃거리를 알려주세요.이메일 : 카카오톡 : @노컷뉴스사이트 : https://url.kr/b71afn"
480,2022/08/25,"카카오게임즈, 'VR 버스'로 디지털 사각지대 찾아간다","카카오게임즈가 '디지털 사각지대' 해소를 위해 팔을 걷어붙였다. 자사 주력 사업인 '게임'을 활용해 디지털... 카카오게임즈는 게임의 선한 영향력을 주목하고, 이를 사회에 알리는 캠페인에 집중해왔다. 2019년 10월 첫..."
481,2022/08/25,"[마감] LG이노텍, 테슬라에 1조원 협의 보도 '강세'...와이지엔터, 상승","24%), 카카오(1.60%), 기아(3.26%) 등이 상승했다. 삼성SDI(-0.68%)는 하락했다. LG이노텍(4.75%)은 최근 테슬라... 시총 상위주는 셀트리온헬스케어(2.90%), 에코프로비엠(0.95%), 엘앤에프(2.85%), HLB(3.31%), 카카오게임즈(1.71..."
482,2022/08/25,"카카오게임즈, ‘찾아가는 프렌즈게임 랜드’ 지역 확대",카카오게임즈가 ‘디지털 사각지대’ 해소를 위해 팔을 걷어붙였다. ‘찾아가는 프렌드게임 랜드’의 지역을 확대해 사회공헌 범위를 넓혀가고 있다. 25일 카카오게임즈는 ‘찾아가는 프렌즈게임 랜드’의 지역을...
483,2022/08/25,카카오게임즈 '찾아가는 프렌즈게임 랜드' 전남 장흥군와 업무협약,카카오게임즈(대표 조계현)는 지난 24일 전라남도 장흥군과 사회공헌 캠페인 '찾아가는 프렌즈게임 랜드'의... 찾아가는 프렌즈게임 랜드는 '카카오프렌즈' 캐릭터와 함께 즐기는 가상현실(VR) 테마파크 게임 콘텐츠에...
484,2022/08/25,"'끝내주는' 배정대…마법의 뒷심 kt, 선두 SSG 잡고 파죽의 4연승","※CBS노컷뉴스는 여러분의 제보로 함께 세상을 바꿉니다. 각종 비리와 부당대우, 사건사고와 미담 등 모든 얘깃거리를 알려주세요.이메일 : 카카오톡 : @노컷뉴스사이트 : https://url.kr/b71afn"
485,2022/08/25,"K2, 신상 플리스·다운 '얼리버드 프로모션'...최대 20% 할인","이번 프로모션은 신상 다운 및 플리스, 신발 구매 시(일부 품목) 20% 할인 혜택을 제공하며 K2 카카오톡 플러스 친구 추가 시 의류 제품에 한해 10% 추가 할인 혜택을 제공한다. 단 얼리버드 프로모션 제품 구매 시..."
